{
  "format": "roost.stage-results",
  "format_version": 3,
  "task": "kernel-conformance",
  "profile": "kernels/roost-kernels-sm86",
  "stage": "cuda",
  "candidate": "libroost_kernels_sm86.so@sha256:d84e95be84b608ec3baee330a58675a7280af45f299fb9c4402cf073a3ba7370",
  "producer": {
    "name": "tests/Starlings.Roost.Conformance/sanitize.py",
    "repository_commit": "7b2b2cf3961de49d94704b8126e25ce96a683ea1"
  },
  "environment": {
    "provider": "cuda",
    "provider_options": {
      "compute_sanitizer": "NVIDIA (R) Compute Sanitizer Copyright (c) 2020-2026 NVIDIA Corporation Version 2026.2.1.0 (build 38334959) (public-release)",
      "case_profile": "sanitizer",
      "device": "3090"
    }
  },
  "assets": [
    {
      "path": "libroost_kernels_sm86.so",
      "sha256": "d84e95be84b608ec3baee330a58675a7280af45f299fb9c4402cf073a3ba7370"
    }
  ],
  "cases": {
    "RmsNorm/rms-norm-flashinfer/memcheck": {
      "op": "RmsNorm",
      "variant": "rms-norm-flashinfer",
      "tool": "memcheck",
      "outcome": "pass",
      "sanitizer_errors": 0,
      "sanitizer_warnings": 0,
      "exit_code": 0,
      "conformance_passed": 24,
      "conformance_failed": 0,
      "conformance_green": true,
      "log": "rms-norm-flashinfer.memcheck.sanitizer.log",
      "log_sha256": "be43266a7d902f3876c503fc344bb7ca8b0dc750da7ca06ce64389b6b8a019db"
    },
    "QkNorm/qk-norm-flashinfer/memcheck": {
      "op": "QkNorm",
      "variant": "qk-norm-flashinfer",
      "tool": "memcheck",
      "outcome": "pass",
      "sanitizer_errors": 0,
      "sanitizer_warnings": 0,
      "exit_code": 0,
      "conformance_passed": 18,
      "conformance_failed": 0,
      "conformance_green": true,
      "log": "qk-norm-flashinfer.memcheck.sanitizer.log",
      "log_sha256": "be43266a7d902f3876c503fc344bb7ca8b0dc750da7ca06ce64389b6b8a019db"
    },
    "Rope/rope-roost/memcheck": {
      "op": "Rope",
      "variant": "rope-roost",
      "tool": "memcheck",
      "outcome": "pass",
      "sanitizer_errors": 0,
      "sanitizer_warnings": 0,
      "exit_code": 0,
      "conformance_passed": 36,
      "conformance_failed": 0,
      "conformance_green": true,
      "log": "rope-roost.memcheck.sanitizer.log",
      "log_sha256": "be43266a7d902f3876c503fc344bb7ca8b0dc750da7ca06ce64389b6b8a019db"
    },
    "PagedAttention/paged-attention-flashinfer-fa2/memcheck": {
      "op": "PagedAttention",
      "variant": "paged-attention-flashinfer-fa2",
      "tool": "memcheck",
      "outcome": "pass",
      "sanitizer_errors": 0,
      "sanitizer_warnings": 0,
      "exit_code": 0,
      "conformance_passed": 23,
      "conformance_failed": 0,
      "conformance_green": true,
      "log": "paged-attention-flashinfer-fa2.memcheck.sanitizer.log",
      "log_sha256": "be43266a7d902f3876c503fc344bb7ca8b0dc750da7ca06ce64389b6b8a019db"
    },
    "SiluAndMul/silu-and-mul-flashinfer/memcheck": {
      "op": "SiluAndMul",
      "variant": "silu-and-mul-flashinfer",
      "tool": "memcheck",
      "outcome": "pass",
      "sanitizer_errors": 0,
      "sanitizer_warnings": 0,
      "exit_code": 0,
      "conformance_passed": 22,
      "conformance_failed": 0,
      "conformance_green": true,
      "log": "silu-and-mul-flashinfer.memcheck.sanitizer.log",
      "log_sha256": "be43266a7d902f3876c503fc344bb7ca8b0dc750da7ca06ce64389b6b8a019db"
    },
    "Gemm/gemm-cublaslt/memcheck": {
      "op": "Gemm",
      "variant": "gemm-cublaslt",
      "tool": "memcheck",
      "outcome": "pass",
      "sanitizer_errors": 0,
      "sanitizer_warnings": 0,
      "exit_code": 0,
      "conformance_passed": 30,
      "conformance_failed": 0,
      "conformance_green": true,
      "log": "gemm-cublaslt.memcheck.sanitizer.log",
      "log_sha256": "be43266a7d902f3876c503fc344bb7ca8b0dc750da7ca06ce64389b6b8a019db"
    },
    "Embedding/embedding-roost/memcheck": {
      "op": "Embedding",
      "variant": "embedding-roost",
      "tool": "memcheck",
      "outcome": "pass",
      "sanitizer_errors": 0,
      "sanitizer_warnings": 0,
      "exit_code": 0,
      "conformance_passed": 20,
      "conformance_failed": 0,
      "conformance_green": true,
      "log": "embedding-roost.memcheck.sanitizer.log",
      "log_sha256": "be43266a7d902f3876c503fc344bb7ca8b0dc750da7ca06ce64389b6b8a019db"
    },
    "LmHead/lm-head-cublaslt/memcheck": {
      "op": "LmHead",
      "variant": "lm-head-cublaslt",
      "tool": "memcheck",
      "outcome": "pass",
      "sanitizer_errors": 0,
      "sanitizer_warnings": 0,
      "exit_code": 0,
      "conformance_passed": 10,
      "conformance_failed": 0,
      "conformance_green": true,
      "log": "lm-head-cublaslt.memcheck.sanitizer.log",
      "log_sha256": "be43266a7d902f3876c503fc344bb7ca8b0dc750da7ca06ce64389b6b8a019db"
    },
    "Residual/residual-stub/memcheck": {
      "op": "Residual",
      "variant": "residual-stub",
      "tool": "memcheck",
      "outcome": "pass",
      "sanitizer_errors": 0,
      "sanitizer_warnings": 0,
      "exit_code": 0,
      "conformance_passed": 24,
      "conformance_failed": 0,
      "conformance_green": true,
      "log": "residual-stub.memcheck.sanitizer.log",
      "log_sha256": "be43266a7d902f3876c503fc344bb7ca8b0dc750da7ca06ce64389b6b8a019db"
    },
    "CacheWrite/cache-write-roost/memcheck": {
      "op": "CacheWrite",
      "variant": "cache-write-roost",
      "tool": "memcheck",
      "outcome": "pass",
      "sanitizer_errors": 0,
      "sanitizer_warnings": 0,
      "exit_code": 0,
      "conformance_passed": 14,
      "conformance_failed": 0,
      "conformance_green": true,
      "log": "cache-write-roost.memcheck.sanitizer.log",
      "log_sha256": "be43266a7d902f3876c503fc344bb7ca8b0dc750da7ca06ce64389b6b8a019db"
    },
    "CacheCopy/cache-copy-roost/memcheck": {
      "op": "CacheCopy",
      "variant": "cache-copy-roost",
      "tool": "memcheck",
      "outcome": "pass",
      "sanitizer_errors": 0,
      "sanitizer_warnings": 0,
      "exit_code": 0,
      "conformance_passed": 8,
      "conformance_failed": 0,
      "conformance_green": true,
      "log": "cache-copy-roost.memcheck.sanitizer.log",
      "log_sha256": "be43266a7d902f3876c503fc344bb7ca8b0dc750da7ca06ce64389b6b8a019db"
    },
    "GatedDeltaRule/gated-delta-rule-chunk-aot/memcheck": {
      "op": "GatedDeltaRule",
      "variant": "gated-delta-rule-chunk-aot",
      "tool": "memcheck",
      "outcome": "pass",
      "sanitizer_errors": 0,
      "sanitizer_warnings": 0,
      "exit_code": 0,
      "conformance_passed": 9,
      "conformance_failed": 0,
      "conformance_green": true,
      "log": "gated-delta-rule-chunk-aot.memcheck.sanitizer.log",
      "log_sha256": "be43266a7d902f3876c503fc344bb7ca8b0dc750da7ca06ce64389b6b8a019db"
    },
    "GatedDeltaRule/gated-delta-rule-recurrent-aot/memcheck": {
      "op": "GatedDeltaRule",
      "variant": "gated-delta-rule-recurrent-aot",
      "tool": "memcheck",
      "outcome": "pass",
      "sanitizer_errors": 0,
      "sanitizer_warnings": 0,
      "exit_code": 0,
      "conformance_passed": 9,
      "conformance_failed": 0,
      "conformance_green": true,
      "log": "gated-delta-rule-recurrent-aot.memcheck.sanitizer.log",
      "log_sha256": "be43266a7d902f3876c503fc344bb7ca8b0dc750da7ca06ce64389b6b8a019db"
    },
    "CausalConv1d/causal-conv1d-cuda/memcheck": {
      "op": "CausalConv1d",
      "variant": "causal-conv1d-cuda",
      "tool": "memcheck",
      "outcome": "pass",
      "sanitizer_errors": 0,
      "sanitizer_warnings": 0,
      "exit_code": 0,
      "conformance_passed": 11,
      "conformance_failed": 0,
      "conformance_green": true,
      "log": "causal-conv1d-cuda.memcheck.sanitizer.log",
      "log_sha256": "be43266a7d902f3876c503fc344bb7ca8b0dc750da7ca06ce64389b6b8a019db"
    },
    "RecurrentStateCopy/recurrent-state-copy-cuda/memcheck": {
      "op": "RecurrentStateCopy",
      "variant": "recurrent-state-copy-cuda",
      "tool": "memcheck",
      "outcome": "pass",
      "sanitizer_errors": 0,
      "sanitizer_warnings": 0,
      "exit_code": 0,
      "conformance_passed": 6,
      "conformance_failed": 0,
      "conformance_green": true,
      "log": "recurrent-state-copy-cuda.memcheck.sanitizer.log",
      "log_sha256": "be43266a7d902f3876c503fc344bb7ca8b0dc750da7ca06ce64389b6b8a019db"
    },
    "RecurrentStateSnapshot/recurrent-state-snapshot-cuda/memcheck": {
      "op": "RecurrentStateSnapshot",
      "variant": "recurrent-state-snapshot-cuda",
      "tool": "memcheck",
      "outcome": "pass",
      "sanitizer_errors": 0,
      "sanitizer_warnings": 0,
      "exit_code": 0,
      "conformance_passed": 7,
      "conformance_failed": 0,
      "conformance_green": true,
      "log": "recurrent-state-snapshot-cuda.memcheck.sanitizer.log",
      "log_sha256": "be43266a7d902f3876c503fc344bb7ca8b0dc750da7ca06ce64389b6b8a019db"
    },
    "GatedDeltaRuleGates/gated-delta-rule-gates-cuda/memcheck": {
      "op": "GatedDeltaRuleGates",
      "variant": "gated-delta-rule-gates-cuda",
      "tool": "memcheck",
      "outcome": "pass",
      "sanitizer_errors": 0,
      "sanitizer_warnings": 0,
      "exit_code": 0,
      "conformance_passed": 8,
      "conformance_failed": 0,
      "conformance_green": true,
      "log": "gated-delta-rule-gates-cuda.memcheck.sanitizer.log",
      "log_sha256": "be43266a7d902f3876c503fc344bb7ca8b0dc750da7ca06ce64389b6b8a019db"
    },
    "GatedRmsNorm/gated-rms-norm-cuda/memcheck": {
      "op": "GatedRmsNorm",
      "variant": "gated-rms-norm-cuda",
      "tool": "memcheck",
      "outcome": "pass",
      "sanitizer_errors": 0,
      "sanitizer_warnings": 0,
      "exit_code": 0,
      "conformance_passed": 8,
      "conformance_failed": 0,
      "conformance_green": true,
      "log": "gated-rms-norm-cuda.memcheck.sanitizer.log",
      "log_sha256": "be43266a7d902f3876c503fc344bb7ca8b0dc750da7ca06ce64389b6b8a019db"
    },
    "SigmoidMul/sigmoid-mul-cuda/memcheck": {
      "op": "SigmoidMul",